{
  "name": "Juan Pérez Garcia",
  "email": "juan.perez.dev@email.com",
  "phone": "+34 600 123 456",
  "resumen": "Desarrollador Full Stack con 5 años de experiencia en el diseño, desarrollo y despliegue de aplicaciones web escalables. Especializado en Python (FastAPI, Django) y JavaScript (React, Node.js), con un fuerte enfoque en la calidad del código, las metodologías Ágiles y la optimización del rendimiento. Buscando un rol desafiante para aplicar habilidades técnicas y contribuir al éxito de proyectos innovadores.",
  "experiencia": [
    {
      "puesto": "Desarrollador Full Stack Senior",
      "empresa": "Tech Solutions S.L.",
      "periodo": "Febrero 2022 — Presente",
      "descripcion": "Liderazgo técnico en el desarrollo de microservicios RESTful con FastAPI y PostgreSQL, incrementando la eficiencia del backend en un 25%. Diseño e implementación de interfaces de usuario interactivas usando React y Redux. Integración continua y despliegue (CI/CD) con Jenkins y Docker. Mentorización de desarrolladores junior y revisión de código."
    },
    {
      "puesto": "Desarrollador Backend",
      "empresa": "Innovatech Corp.",
      "periodo": "Marzo 2019 - Enero 2022",
      "descripcion": "Desarrollo de APIs REST con Django y Django REST Framework, manejando una base de datos MySQL. Optimización de consultas de base de datos que redujo el tiempo de respuesta en un 30%. Participación activa en el ciclo de vida completo del desarrollo de software, incluyendo análisis de requisitos, diseño, codificación, pruebas y soporte."
    }
  ],
  "educacion": [
    {
      "titulo": "Master en Ingenieria Informatica",
      "institucion": "Universidad Politécnica de Madrid",
      "periodo": "Septiembre 2017 — Julio 2019"
    }
  ],
  "habilidades": [
    "Python",
    "FastAPI",
    "Django",
    "JavaScript",
    "React",
    "Node.js",
    "PostgreSQL",
    "MySQL",
    "Jenkins",
    "Docker",
    "Redux"
  ],
  "soft_skills": [
    "Liderazgo",
    "Mentoría",
    "Trabajo en equipo",
    "Resolución de problemas",
    "Comunicación efectiva"
  ],
  "full_text": "Juan Pérez Garcia\n\nDesarrollador Full Stack\n\nContacto\n\n¢ Teléfono: +34 600 123 456\n\ne Email: juan.perez.dev@email.com\n\ne LinkedIn: linkedin.com/in/juanperezdev\n\ne GitHub: github.com/juanperezdev\n\ne Direccién: Calle Ficticia 123, 28001 Madrid, Espafia\n\nResumen Profesional\n\nDesarrollador Full Stack con 5 afios de experiencia en el disefio, desarrollo y\ndespliegue de aplicaciones web escalables. Especializado en Python (FastAPI,\nDjango) y JavaScript (React, Node.js), con un fuerte enfoque en la calidad del\ncédigo, las metodologias Agiles y la optimizacién del rendimiento. Buscando un\nrol desafiante para aplicar habilidades técnicas y contribuir al éxito de proyectos\ninnovadores.\n\nExperiencia Laboral\n\nDesarrollador Full Stack Senior | Tech Solutions S.L. | Madrid, Espafia\nFebrero 2022 — Presente * Liderazgo técnico en el desarrollo de microservicios\nRESTful con FastAPI y PostgreSQL, incrementando la eficiencia del backend en\nun 25%. * Disefio e implementacién de interfaces de usuario interactivas usando\nReact y Redux. * Integracién continua y despliegue (CI/CD) con Jenkins y\nDocker. * Mentorizacién de desarrolladores junior y revisién de cédigo.\n\nDesarrollador Backend | Innovatech Corp. | Barcelona, Espafia Marzo 2019 -\nEnero 2022 * Desarrollo de APIs REST con Django y Django REST Framework,\nmanejando una base de datos MySQL. * Optimizacién de consultas de base de\ndatos que redujo el tiempo de respuesta en un 30%. * Participacién activa\nen el ciclo de vida completo del desarrollo de software, incluyendo andlisis de\nrequisitos, disefio, codificacién, pruebas y soporte.\n\nEducacién\n\nMaster en Ingenieria Informatica | Universidad Politécnica de Madrid |\nMadrid, Espaiia Septiembre 2017 — Julio 2019\n"
}